SGTIJIRA01-58136;820453;OKR1.3.2.1 Aprimorar a eficiência e a inteligência de precificação;Em Progresso;PI#8BAR;;;0.0;3;0;O1.3.2 Aprimorar a eficiência e a inteligência de precificação;KR1.3.2.1 Criação de 3 bases para utilização no roteiro de calculo;Ciclo 2025;3;;BAR Precificação e Aceitação de Risco Auto;;Medição ao final do 4º trim;Não;Desenvolvimento_Produto_AUTO;;0.0;BARE;;;;;;;;;;;;;;;;;;;;;BARNISA000-227;SGTIJIRA01-51174;BARNISA000-174;BARNISA000-228;BARNISA000-229;;;;;;;;;;;;;;;;;;;;;;
SGTIJIRA01-58135;820452;"OKR1.8 Ampliar e fortalecer o portifólio de produtos AUTO, promovendo competitividade e eficiência por meio de modelos flexiveis e inteligentes de precificação e subscrição, trazendo rentabilidade para a companhia e aumento market share.";Em Progresso;PI#8BAR;;;0.0;0;0;"O1 Ampliar e fortalecer o portifólio de produtos AUTO, promovendo competitividade e eficiência por meio de modelos flexíveis e inteligentes de precificação e subscrição e trazendo rentabilidade para a companhia e aumento market share.";KR1.8 Aumentar a receita através da análise de casos de aceitação restrita;Ciclo 2025;;;"BAR Melhorias Auto Individual
BAR Melhorias Auto Frota
BAR Novos Produtos
BAR Precificação e Aceitação de Risco Auto
";;Medição ao final do 4º trim;Não;Desenvolvimento_Produto_AUTO;;0.0;BARE;;;;;;;;;;;;;;;;;;;;;SGTIJIRA01-58143;SGTIJIRA01-58144;;;;;;;;;;;;;;;;;;;;;;;;;
SGTIJIRA01-58134;820451;"OKR1.7 Ampliar e fortalecer o portifólio de produtos AUTO, promovendo competitividade e eficiência por meio de modelos flexiveis e inteligentes de precificação e subscrição, trazendo rentabilidade para a companhia e aumento market share.";Em Progresso;PI#8BAR;;;0.0;541;0;"O1 Ampliar e fortalecer o portifólio de produtos AUTO, promovendo competitividade e eficiência por meio de modelos flexíveis e inteligentes de precificação e subscrição e trazendo rentabilidade para a companhia e aumento market share.";KR1.7 Aumentar a produção do Auto com novos produtos em todos os canais de venda em 541MM;Ciclo 2025;;;"BAR Melhorias Auto Individual
BAR Melhorias Auto Frota
BAR Novos Produtos
BAR Precificação e Aceitação de Risco Auto
";;Medição ao final do 4º trim;Não;Desenvolvimento_Produto_AUTO;;0.0;BARE;;;;;;;;;;;;;;;;;;;;;SGTIJIRA01-58142;;;;;;;;;;;;;;;;;;;;;;;;;;
SGTIJIRA01-58133;820450;"OKR1.6 Ampliar e fortalecer o portifólio de produtos AUTO, promovendo competitividade e eficiência por meio de modelos flexiveis e inteligentes de precificação e subscrição, trazendo rentabilidade para a companhia e aumento market share.";Em Progresso;PI#8BAR;;;0.0;139;0;"O1 Ampliar e fortalecer o portifólio de produtos AUTO, promovendo competitividade e eficiência por meio de modelos flexíveis e inteligentes de precificação e subscrição e trazendo rentabilidade para a companhia e aumento market share.";KR1.6 Aumentar a receita do Auto Frota em R$139MM;Ciclo 2025;;;"BAR Melhorias Auto Individual
BAR Melhorias Auto Frota
BAR Novos Produtos
BAR Precificação e Aceitação de Risco Auto
";;Medição ao final do 4º trim;Não;Desenvolvimento_Produto_AUTO;;0.0;BARE;;;;;;;;;;;;;;;;;;;;;SGTIJIRA01-58139;SGTIJIRA01-58141;SGTIJIRA01-58140;;;;;;;;;;;;;;;;;;;;;;;;
SGTIJIRA01-58132;820449;"OKR1.5 Ampliar e fortalecer o portifólio de produtos AUTO, promovendo competitividade e eficiência por meio de modelos flexiveis e inteligentes de precificação e subscrição, trazendo rentabilidade para a companhia e aumento market share.";Em Progresso;PI#8BAR;;;0.0;62;0;"O1 Ampliar e fortalecer o portifólio de produtos AUTO, promovendo competitividade e eficiência por meio de modelos flexíveis e inteligentes de precificação e subscrição e trazendo rentabilidade para a companhia e aumento market share.";KR1.5 Aumentar a receita do Auto Individual em R$62MM;Ciclo 2025;;;"BAR Melhorias Auto Individual
BAR Melhorias Auto Frota
BAR Novos Produtos
BAR Precificação e Aceitação de Risco Auto
";;Medição ao final do 4º trim;Não;Desenvolvimento_Produto_AUTO;;0.0;BARE;;;;;;;;;;;;;;;;;;;;;SGTIJIRA01-58137;SGTIJIRA01-58138;;;;;;;;;;;;;;;;;;;;;;;;;
SGTIJIRA01-58130;820053;OKR1.3.2.1 Atingir 400 mil direcionamentos para o e-commerce com as funcionalidades do Minhas Proteções e Open Insurance até dezembro de 2025;FINALIZADO;PI#5DIG;;;313892.0;400000;412342;O1.3.2 Atingir 400 mil direcionamentos para o e-commerce com as funcionalidades do Minhas Proteções e Open Insurance até dezembro de 2025;KR1.3.2.1 Atingir 400 mil direcionamentos para o e-commerce com as funcionalidades do Minhas Proteções e Open Insurance até dezembro de 2025;Ciclo 2025;3;;;;Medição ao final do 4º trim;Não;VS_OPIN;;100.0;Digital;SGTIJIRA01-51265;;;;;;;;;;;;;;;;;;;;SDIGBSMO05-1392;SDIGBSMO05-1391;SDIGBSMO05-1338;SDIGBSMO05-1393;;;;;;;;;;;;;;;;;;;;;;;
SGTIJIRA01-58129;820052;OKR1.2.3.1 Atingir 500 consentimentos recebidos novos do Open Insurance até dezembro de 2025;FINALIZADO;PI#5DIG;;;498.0;1000;1227;O1.2.3 Atingir 1000 consentimentos recebidos novos do Open Insurance até dezembro de 2025;KR1.2.3.1 Atingir 1000 consentimentos recebidos novos do Open Insurance até dezembro de 2025;Ciclo 2025;3;;;;Medição ao final do 4º trim;Não;VS_OPIN;;100.0;Digital;SGTIJIRA01-50757;;;;;;;;;;;;;;;;;;;;SDIGBSMO02-3218;SDIGBSMO02-2920;SDIGBSMO05-1391;SDIGBSMO02-3063;SDIGBSMO05-1338;SDIGBSMO02-2919;SDIGBSMO02-3060;SDIGBSMO02-3217;;;;;;;;;;;;;;;;;;;
SGTIJIRA01-58128;820051;OKR2.1.2.1 Oferecer a melhor experiência na contração de produtos;Em Progresso;PI#5DIG;;;0.0;5;3;O2.1.2 Oferecer a melhor experiência na contração de produtos;KR2.1.2.1 Implementar 5 melhorias na jornada da Loja BS;Ciclo 2025;3;;;;Medição ao final do 4º trim;Não;VS_Vendas_Ecommerce;;60.0;Digital;;;;;;;;;;;;;;;;;;;;;SGTIJIRA01-51239;DIGBSEC000-4046;DIGBSEC000-3654;DIGBSEC000-2256;DIGBSEC001-1698;DIGBSEC001-1729;;;;;;;;;;;;;;;;;;;;;
SGTIJIRA01-58127;820049;OKR1.1.2.2 Conquistar mais usuários mar aberto para Loja BS;FINALIZADO;PI#5DIG;;;0.0;1;1;O1.1.2 Conquistar mais usuários mar aberto para Loja BS;KR1.1.2.2 Habilitar componente do produto Residencial no Whatsapp;Ciclo 2025;3;;;;Medição ao final do 4º trim;Não;VS_Vendas_Ecommerce;;100.0;Digital;SGTIJIRA01-51238;;;;;;;;;;;;;;;;;;;;DIGBSEC000-4155;DIGBSEC000-3017;;;;;;;;;;;;;;;;;;;;;;;;;
SGTIJIRA01-58126;820048;OKR1.1.2.1 Conquistar mais usuários mar aberto para Loja BS;FINALIZADO;PI#5DIG;;;0.0;1;1;O1.1.2 Conquistar mais usuários mar aberto para Loja BS;KR1.1.2.1 Habilitar OPIN dentro do e-commerce;Ciclo 2025;1;Atingiu a Meta;;;;Não;VS_Vendas_Ecommerce;;100.0;Digital;SGTIJIRA01-51238;;;;;;;;;;;;;;;;;;;;DIGBSEC001-1278;;;;;;;;;;;;;;;;;;;;;;;;;;
SGTIJIRA01-58125;818438;OKR1.4.2.1 Impulsionar estratégia de utilização do APP;FINALIZADO;PI#5DIG;;;0.0;1;1;O1.4.2 Impulsionar estratégia de utilização do APP;KR1.4.2.1 Habilitar melhorias de usabilidade app corretor;Ciclo 2025;2;Atingiu a Meta;;;Medição ao final do 4º trim;Não;VS_Corretor_Mobilidade;;100.0;Digital;SDIGBSMO03-3039;SGTIJIRA01-51276;;;;;;;;;;;;;;;;;;;;;;;;;;;;;;;;;;;;;;;;;;;;;
SGTIJIRA01-58124;818436;OKR1.3.2.1 Ampliar catálogo de serviços disponíveis aos corretores no WPP;FINALIZADO;PI#5DIG;;;0.0;1;1;O1.3.2 Ampliar catálogo de serviços disponíveis aos corretores no WPP;KR1.3.2.1 Implementar novas jornadas de autosserviço no wpp;Ciclo 2025;1;Atingiu a Meta;;;;Não;VS_Corretor_Mobilidade;;100.0;Digital;SDIGBSBI00-5812;SGTIJIRA01-51220;;;;;;;;;;;;;;;;;;;;;;;;;;;;;;;;;;;;;;;;;;;;;
SGTIJIRA01-58123;818435;OKR1.2.3.1 Identificar percepção dos corretores na utilização dos canais;Em Progresso;PI#5DIG;;;0.0;3;1;O1.2.3 Identificar percepção dos corretores na utilização dos canais;KR1.2.3.1 Criar pesquisa de NPS nos canais APP e WhatsApp;Ciclo 2025;2;;;;Medição ao final do 4º trim;Não;VS_Corretor_Mobilidade;;33.0;Digital;SDIGBSBI00-5811;SDIGBSBI00-5911;SDIGBSMO03-2830;;;;;;;;;;;;;;;;;;SGTIJIRA01-51219;;;;;;;;;;;;;;;;;;;;;;;;;;
SGTIJIRA01-58122;818434;OKR1.2.2.1 Disponibilizar jornadas de autosserviço para o corretor;Em Progresso;PI#5DIG;;;0.0;3;0;O1.2.2  Disponibilizar jornadas de autosserviço para o corretor ;KR1.2.2.1 Implementar novas jornadas de pós venda de seguros no app;Ciclo 2025;2;;;;Medição ao final do 4º trim;Não;VS_Corretor_Mobilidade;;;Digital;SDIGBSMO03-3038;SDIGBSMO03-3037;SGTIJIRA01-51219;SDIGBSMO03-11;;;;;;;;;;;;;;;;;;;;;;;;;;;;;;;;;;;;;;;;;;;
SGTIJIRA01-58121;818433;OKR1.1.2.1 Ampliar catálogo de serviços disponíveis aos corretores utilizando IA Generativa;Em Progresso;PI#5DIG;;;0.0;4;2;O1.1.2 Ampliar catálogo de serviços disponíveis aos corretores utilizando IA Generativa;KR1.1.2.1 Implantar novos serviços informacionais de produtos utilizando  IA Generativa nos canais BIA e WPP.;Ciclo 2025;2;;;;Medição ao final do 4º trim;Não;VS_Corretor_Mobilidade;;50.0;Digital;SGTIJIRA01-51218;SDIGBSBI00-5816;SDIGBSBI00-5925;SDIGBSBI00-5817;SDIGBSBI00-5983;;;;;;;;;;;;;;;;;;;;;;;;;;;;;;;;;;;;;;;;;;
SGTIJIRA01-58120;818242;OKR1.2.5.1 Melhorar a jornada de contratação para o corretor;Em Progresso;PI#8BAR;;;5.0;9;0;O1.2.5 Melhorar a jornada de contratação para o corretor;KR1.2.5.1 Implantar as 4 melhorias mais solicitadas pelos corretores Pré-Formatados;Ciclo 2025;3;;"BAR Comercialização dos Produtos
BAR Pré-Formatados";;Medição ao final do 4º trim;Não;Desenvolvimento_Comercialização_Produto_RE;;0.0;BARE;;;;;;;;;;;;;;;;;;;;;SBARREBP06-276;SGTIJIRA01-51135;SBARREBP06-277;SBARREBP06-275;SBARREBP06-279;;;;;;;;;;;;;;;;;;;;;;
SGTIJIRA01-58119;817514;OKR1.3.1.2 Implantar uma nova jornada no Portal Administrativo;Em Progresso;PI#5DIG;;;0.0;1;0;O1.3.1 Permitir a personalização dos planos de acordo com a preferencia dos clientes;KR1.3.1.2 Implantar uma nova jornada no Portal Administrativo;Ciclo 2025;2;;;;Medição ao final do 4º trim;Não;VS_Corretor_Odontoprev;;0.0;Digital;SGTIJIRA01-58117;SSAUVCOR00-1237;SSAUVCOR00-1238;;;;;;;;;;;;;;;;;;;;;;;;;;;;;;;;;;;;;;;;;;;;
SGTIJIRA01-58118;817513;OKR1.3.1.1 Implantar uma nova jornada no Portal do Corretor ;Em Progresso;PI#5DIG;;;0.0;1;0;O1.3.1 Permitir a personalização dos planos de acordo com a preferencia dos clientes;KR1.3.1.1 Implantar uma nova jornada no Portal do Corretor;Ciclo 2025;2;;;;Medição ao final do 4º trim;Não;VS_Corretor_Odontoprev;;0.0;Digital;SGTIJIRA01-58117;SSAUVCOR00-1239;;;;;;;;;;;;;;;;;;;;;;;;;;;;;;;;;;;;;;;;;;;;;
SGTIJIRA01-58117;817512;OKR1.3 Aumentar em 3% de entradas de vidas Bradesco PF;Em Progresso;PI#5DIG;;;0.0;3;0;"O1 Melhorar cada vez mais a jornada do corretor Bradesco Dental, contribuindo com soluções ágeis para auxiliá-lo nas vendas e no controle de sua carteira de clientes em 2025";KR1.3 Aumentar em 3% de entradas de vidas Bradesco PF;Ciclo 2025;;;;;Medição ao final do 4º trim;Não;VS_Corretor_Odontoprev;;0.0;Digital;;;;;;;;;;;;;;;;;;;;;SGTIJIRA01-58118;SGTIJIRA01-58119;;;;;;;;;;;;;;;;;;;;;;;;;
SGTIJIRA01-53948;812668;OKR2.1.2.1 Impulsionar vendas digitais dentro da estratégia do Change the bank;Em Progresso;PI#5DIG;;;0.0;4;1;O2.1.2 Impulsionar vendas digitais dentro da estratégia do Change the bank;KR2.1.2.1 Disponibilizar 4 novos produtos de seguros para atender estratégia do Change the Bank;Ciclo 2025;3;;;;Medição ao final do 4º trim;Não;VS_Vendas_Bancassurance;;25.0;Digital;SGTIJIRA01-51307;;;;;;;;;;;;;;;;;;;;SDIGVPLI00-12112;SDIGVPLI00-12065;SDIGVPLI00-11367;SDIGVPLI00-12066;;;;;;;;;;;;;;;;;;;;;;;
SGTIJIRA01-53947;812666;OKR1.3.5.1 Melhorar a experiência do cliente nas jornadas de venda e pós venda previdência no app;Em Progresso;PI#5DIG;;;0.0;5;0;O1.3.5 Melhorar a experiência do cliente nas jornadas de venda e pós venda previdência no app;KR1.3.5.1 Disponibilizar 5  funcionalidades de gestão de carteira de previdência;Ciclo 2025;3;;;;Medição ao final do 4º trim;Não;VS_Vendas_Bancassurance;;0.0;Digital;;;;;;;;;;;;;;;;;;;;;SDIGVSBV02-77;SDIGVSBV02-663;SDIGVSBV02-1464;SGTIJIRA01-50960;SDIGVSBV02-1465;SDIGVSBV02-1463;;;;;;;;;;;;;;;;;;;;;
SGTIJIRA01-53815;812626;OKR1.1.3.2 Ampliar oferta de produtos de seguros para correntistas Bradesco;Em Progresso;PI#5DIG;;;0.0;6;3;O1.1.3 Ampliar oferta de produtos de seguros para correntistas Bradesco;KR1.1.3.2 Habilitar 6 comunicações para os clientes para estimular contratação de produtos.;Ciclo 2025;3;;;;Medição ao final do 4º trim;Não;VS_Vendas_Bancassurance;;50.0;Digital;;;;;;;;;;;;;;;;;;;;;SDIGVSBV02-1462;SGTIJIRA01-50958;SDIGCCOR00-2339;SDIGCCOR00-2525;SDIGCCOR00-2516;SDIGCIBC00-2076;;;;;;;;;;;;;;;;;;;;;
SGTIJIRA01-53814;812623;OKR1.1.3.1 Ampliar oferta de produtos de seguros para correntistas Bradesco;Em Progresso;PI#5DIG;;;0.0;4;1;O1.1.3 Ampliar oferta de produtos de seguros para correntistas Bradesco;KR1.1.3.1 Disponibilizar 4 novos produtos de seguros para contratação por autosserviço;Ciclo 2025;3;;;;Medição ao final do 4º trim;Não;VS_Vendas_Bancassurance;;25.0;Digital;;;;;;;;;;;;;;;;;;;;;SDIGCCOR00-2344;SGTIJIRA01-50958;SDIGVSBV02-1462;SDIGCIBC00-2273;SDIGCIBC00-807;;;;;;;;;;;;;;;;;;;;;;
SGTIJIRA01-51650;808678;"OKR1.1.5.1 Garantir a rastreabilidade das ações relacionadas ao Sinistro RE pelo corretor, vinculadas ao nível de CPF";Em Progresso;PI#8BAR;;;0.0;1;0;"O1.1.5 Garantir a rastreabilidade das ações relacionadas ao Sinistro RE pelo corretor, vinculadas ao nível de CPF";"KR1.1.5.1 Identificar as ações do corretor por CPF, relacionadas ao Sinistro RE para ramos diferentes de residenciais";Ciclo 2025;3;;BAR Modernização de Aviso Sinistro;;Medição ao final do 4º trim;Não;Sinistro_RE;;0.0;BARE;;;;;;;;;;;;;;;;;;;;;SGTIJIRA01-51165;SBARSREF00-2;;;;;;;;;;;;;;;;;;;;;;;;;
SGTIJIRA01-51635;807007;OKR1.3.1.2 Habilitar pesquisa de satisfação para monitoramento;Cancelado;PI#4DIG;;;0.0;1;0;"O1.3.1 Melhorar a qualidade do atendimento digital com foco em UX, segurança e estabilidade";KR1.3.1.2 Habilitar pesquisa de satisfação para monitoramento;Ciclo 2025;4;Não Atingiu a Meta;;KR cancelada a pedido da PM Cintia.;;Não;VS_Clientes;;0.0;Digital;SGTIJIRA01-51267;SDIGBSMO01-8913;;;;;;;;;;;;;;;;;;;;;;;;;;;;;;;;;;;;;;;;;;;;;
SGTIJIRA01-51634;807006;OKR1.3.1.1 Reduzir em 50% o volume de reclamações por dificuldade de acesso;FINALIZADO;PI#4DIG;;;0.0;50;47;"O1.3.1 Melhorar a qualidade do atendimento digital com foco em UX, segurança e estabilidade";KR1.3.1.1 Reduzir em 50% o volume de reclamações por dificuldade de acesso;Ciclo 2025;5;Atingiu Parcialmente a Meta;;;;Não;VS_Clientes;;94.0;Digital;SGTIJIRA01-51267;SDIGBSMO01-8340;SDIGBSMO01-8067;;;;;;;;;;;;;;;;;;;;;;;;;;;;;;;;;;;;;;;;;;;;
SGTIJIRA01-51633;807005;OKR1.2.2.2 Habilitar 10 novas jornadas no WPP;FINALIZADO;PI#4DIG;;;0.0;10;10;O1.2.2 Expandir a cobertura de serviços digitais com novas jornadas de autoatendimento;KR1.2.2.2 Habilitar 10 novas jornadas no WPP;Ciclo 2025;5;Atingiu a Meta;;;;;VS_Clientes;;100.0;Digital;;;;;;;;;;;;;;;;;;;;;SGTIJIRA01-51627;SDIGEWHA00-3915;SDIGEWHA00-3089;SDIGEWHA00-4942;SDIGEWHA00-4026;SDIGEWHA00-4991;SDIGEWHA00-4039;SDIGEWHA00-4023;SDIGEWHA00-4938;SDIGEWHA00-4943;SDIGEWHA00-4024;;;;;;;;;;;;;;;;
SGTIJIRA01-51632;807004;OKR1.2.2.1 Habilitar 9 novas jornadas ao APP;FINALIZADO;PI#4DIG;;;0.0;9;9;O1.2.2 Expandir a cobertura de serviços digitais com novas jornadas de autoatendimento.;KR1.2.2.1 Habilitar 9 novas jornadas ao APP;Ciclo 2025;4;Atingiu a Meta;;;;;VS_Clientes;;100.0;Digital;SDIGBSMO01-7381;SDIGBSMO01-8834;SDIGBSMO01-7567;SDIGBSMO01-7639;SDIGBSMO01-7719;SDIGBSMO01-8364;SDIGBSMO01-8365;SDIGBSMO01-8838;SDIGBSMO01-8898;;;;;;;;;;;;SGTIJIRA01-51627;;;;;;;;;;;;;;;;;;;;;;;;;;
SGTIJIRA01-51631;807001;OKR1.2.2.3 Habilitar 6 novas páginas no Portal;FINALIZADO;PI#4DIG;;;0.0;6;6;O1.2.2 Expandir a cobertura de serviços digitais com novas jornadas de autoatendimento.;KR1.2.2.3 Habilitar 6 novas páginas no Portal;Ciclo 2025;4;Atingiu a Meta;;;;;VS_Clientes;;100.0;Digital;;;;;;;;;;;;;;;;;;;;;SGTIJIRA01-51627;SDIGPCWB01-6498;SDIGPCWB01-6616;SDIGPCWB01-6236;SDIGPCWB01-6613;SDIGPCWB01-6127;SDIGPCWB01-6608;;;;;;;;;;;;;;;;;;;;
SGTIJIRA01-51630;806699;OKR1.2.1.2 Habilitar a divulgação do Whatsapp na pagina de Automóvel;FINALIZADO;PI#4DIG;;;0.0;1;1;O1.2.1 Impulsionar o uso dos canais digitais com ações de engajamento e integração entre canais;KR1.2.1.2 Habilitar a divulgação do Whatsapp na pagina de Automóvel;Ciclo 2025;4;Atingiu a Meta;;;;;VS_Clientes;;100.0;Digital;SDIGPCWB01-6943;SGTIJIRA01-51627;;;;;;;;;;;;;;;;;;;;;;;;;;;;;;;;;;;;;;;;;;;;;
SGTIJIRA01-51629;806692;"OKR1.2.1.1 Habilitar 4 jornadas para envio de mensegem ativa (Auto, Novamed, Dental e Vida)";FINALIZADO;PI#4DIG;;;0.0;4;4;O1.2.1 Impulsionar o uso dos canais digitais com ações de engajamento e integração entre canais;"KR1.2.1.1 Habilitar 4 jornadas para envio de mensegem ativa (Auto, Novamed, Dental e Vida)";Ciclo 2025;5;Atingiu a Meta;;;;;VS_Clientes;;100.0;Digital;SDIGEWHA00-4936;SDIGEWHA00-3912;SDIGEWHA00-3958;SDIGEWHA00-3626;;;;;;;;;;;;;;;;;SGTIJIRA01-51627;;;;;;;;;;;;;;;;;;;;;;;;;;
SGTIJIRA01-51628;806689;OKR1.1.2.1 Habilitar o produto Residencial (APP);FINALIZADO;PI#4DIG;;;0.0;1;1;O1.1.2 Potencializar oportunidades de vendas;KR1.1.2.1 Habilitar o produto Residencial (APP);Ciclo 2025;4;Atingiu a Meta;;;;;VS_Clientes;;100.0;Digital;SDIGBSMO01-7566;;;;;;;;;;;;;;;;;;;;SGTIJIRA01-51269;;;;;;;;;;;;;;;;;;;;;;;;;;
SGTIJIRA01-51627;806478;OKR1.2 Aumentar em 15% as consultas/transações nos canais digitais (exceto saúde);Em Progresso;PI#4DIG;PI#5DIG;;0.0;15;0;"O1 Expandir a oferta de serviços digitais, promovendo melhor experiência e autonomia aos clientes";KR1.2 Aumentar em 15% as consultas/transações nos canais digitais (exceto saúde);Ciclo 2025;;;;;;;VS_Clientes;;0.0;Digital;SGTIJIRA01-51632;SGTIJIRA01-51633;SGTIJIRA01-51631;SGTIJIRA01-58150;SGTIJIRA01-58152;SGTIJIRA01-58151;SGTIJIRA01-51629;;;;;;;;;;;;;;SGTIJIRA01-51630;;;;;;;;;;;;;;;;;;;;;;;;;;
SGTIJIRA01-51625;806205;"OKR2.1.1.3 Garantir uma comunicação transparente, ágil e assertiva com o corretor  fornecendo informações precisas e em tempo hábil.";Em Progresso;PI#8BAR;;;2.0;3;0;"O2.1.1 Garantir uma comunicação transparente, ágil e assertiva com o corretor  fornecendo informações precisas e em tempo hábil.";KR2.1.1.3 Aumentar de 2 para 3 o número de comunicações de pagamento refletidas para o corretor no ramo de Automóvel;Ciclo 2025;3;;BAR Jornada de Comunicação;;Medição ao final do 4º trim;Não;VS_Canais_Atendimento_Suporte;;0.0;BARE;;;;;;;;;;;;;;;;;;;;;SBARNISA04-353;SBARNISA04-402;SGTIJIRA01-51090;;;;;;;;;;;;;;;;;;;;;;;;
SGTIJIRA01-51624;806204;"OKR1.1.1.4 Fortalecer a comunicação assertiva com clientes para reduzir a inadimplência, garantindo abordagens estratégicas, personalizadas e humanizadas que reforçam a importância dos pagamentos em dia.";Em Progresso;PI#8BAR;;;0.0;10;0;"O1.1.1 Fortalecer a comunicação assertiva com clientes para reduzir a inadimplência, garantindo abordagens estratégicas, personalizadas e humanizadas que reforçam a importância dos pagamentos em dia.";KR1.1.1.4 Reduzir em 10% os clientes inadimplentes;Ciclo 2025;3;;BAR Jornada de Comunicação;;Medição ao final do 4º trim;Não;VS_Canais_Atendimento_Suporte;;0.0;BARE;SGTIJIRA01-51087;;;;;;;;;;;;;;;;;;;;SBARNISA04-353;SBARNISA04-401;SBARNISA04-375;;;;;;;;;;;;;;;;;;;;;;;;
SGTIJIRA01-51623;806203;"OKR1.1.1.3 Fortalecer a comunicação assertiva com clientes para reduzir a inadimplência, garantindo abordagens estratégicas, personalizadas e humanizadas que reforçam a importância dos pagamentos em dia.";Em Progresso;PI#8BAR;;;0.0;50;0;"O1.1.1 Fortalecer a comunicação assertiva com clientes para reduzir a inadimplência, garantindo abordagens estratégicas, personalizadas e humanizadas que reforçam a importância dos pagamentos em dia.";KR1.1.1.3 Atingir uma taxa de 50% de leitura da carta de inadimplência;Ciclo 2025;3;;BAR Jornada de Comunicação;;Medição ao final do 4º trim;Não;VS_Canais_Atendimento_Suporte;;0.0;BARE;SGTIJIRA01-51087;;;;;;;;;;;;;;;;;;;;SBARNISA04-375;SBARNISA04-353;;;;;;;;;;;;;;;;;;;;;;;;;
SGTIJIRA01-51620;805507;"OKR3.1.2.1 - Melhorar a lucratividade do produto Capital de Giro | Atualizar a precificação do CaGiro em x%";FINALIZADO;PI#16BVP;;;0.0;1;1;O3.1.2 Melhorar a lucratividade do produto Capital de Giro;KR3.1.2.1 Atualizar a precificação % do produto do CaGiro;Ciclo 2025;1;Atingiu a Meta;BVP Prestamista;;Medição ao final do 2º trim;Não;VS_AqRent_Prestamista;;100.0;BVP;SDIGVSBV00-39227;;;;;;;;;;;;;;;;;;;;SGTIJIRA01-51402;;;;;;;;;;;;;;;;;;;;;;;;;;
SGTIJIRA01-51609;802295;"OKR1.4.1.1 Ser uma fonte confiável de dados unificada do RE para companhia; Ter maior rapidez e escalabilidade para prover dados para tomada de decisões da companhia.";Em Progresso;PI#8BAR;;;0.0;5;0;"O1.4.1 Ser uma fonte confiável de dados unificada do RE para companhia; Ter maior rapidez e escalabilidade para prover dados para tomada de decisões da companhia.";KR1.4.1.1 Aquisição de 5% de dados transacionais (RE);Ciclo 2025;3;;BAR Infraestrutura e Ingestão;;Medição ao final do 4º trim;Não;VS_Gestão_de_dados;;0.0;BARE;;;;;;;;;;;;;;;;;;;;;SGTIJIRA01-51111;SBARADAR08-257;;;;;;;;;;;;;;;;;;;;;;;;;
SGTIJIRA01-51608;800676;OKR1.3.2.1 Migrar objetos do MicroStrategy para o PowerBI adequando as novas diretrizes da Bradesco Seguros.;Em Progresso;PI#8BAR;;;0.0;11;1;O1.3.2 Migrar objetos do MicroStrategy para o PowerBI adequando as novas diretrizes da Bradesco Seguros.;KR1.3.2.1 Construção de 11 objetos no PowerBI;Ciclo 2025;3;;BAR Migração de Painéis;;Medição ao final do 4º trim;Não;VS_Gestão_de_dados;;9.0;BARE;;;;;;;;;;;;;;;;;;;;;SBARADAR07-253;SBARADAR07-247;SBARADAR07-248;SBARADAR07-239;SBARADAR07-238;SBARADAR07-249;SBARADAR07-244;SBARADAR07-254;SBARADAR07-246;SBARADAR07-256;SBARADAR07-245;SBARADAR07-255;SBARADAR07-241;SBARADAR07-240;SBARADAR07-250;SBARADAR07-14;SBARADAR07-243;SBARADAR07-242;SBARADAR07-18;SBARADAR07-251;SBARADAR07-252;SGTIJIRA01-51110;SBARADAR07-286;SBARADAR07-411;SBARADAR07-415;;
SGTIJIRA01-51607;800675;OKR1.2.4.1 Ampliar capacidade analítica a partir de dados de Auto.;FINALIZADO;PI#8BAR;;;2.0;4;4;O1.2.4 Ampliar capacidade analítica a partir de dados de Auto.;KR1.2.4.1 Construir 2 produtos de dados de AUTO.;Ciclo 2025;1;Atingiu a Meta;BAR Evolução da Jornada de dados de AUTO;;Medição ao final do 4º trim;Não;VS_Gestão_de_dados;;100.0;BARE;;;;;;;;;;;;;;;;;;;;;SBARADAR05-140;SGTIJIRA01-51109;SBARADAR08-317;SBARADAR05-194;;;;;;;;;;;;;;;;;;;;;;;
SGTIJIRA01-51606;800674;OKR1.2.3.1 Ampliar capacidade analítica a partir de dados de RE.;Em Progresso;PI#8BAR;;;4.0;6;4;O1.2.3 Ampliar capacidade analítica a partir de dados de RE.;KR1.2.3.1 Construir 2 produtos de dados de RE.;Ciclo 2025;3;;BAR Evolução da Jornada de dados de RE;;Medição ao final do 4º trim;Não;VS_Gestão_de_dados;;0.0;BARE;;;;;;;;;;;;;;;;;;;;;SBARADAR06-383;SBARADAR06-379;SBARADAR06-359;SBARADAR06-364;SGTIJIRA01-51109;;;;;;;;;;;;;;;;;;;;;;
SGTIJIRA01-51605;800673;"OKR1.1.2.1 Ser uma fonte confiável de dados do AUTO unificada para companhia; Ter maior rapidez e escalabilidade para prover dados para tomada de decisões da companhia.";FINALIZADO;PI#8BAR;;;0.0;50;50;"O1.1.2 Ser uma fonte confiável de dados do AUTO unificada para companhia; Ter maior rapidez e escalabilidade para prover dados para tomada de decisões da companhia.";KR1.1.2.1 Ingerir 50% dos dados de Auto;Ciclo 2025;1;Atingiu a Meta;BAR Infraestrutura e Ingestão;;Medição ao final do 4º trim;Não;VS_Gestão_de_dados;;100.0;BARE;;;;;;;;;;;;;;;;;;;;;SGTIJIRA01-51108;SBARADAR08-317;;;;;;;;;;;;;;;;;;;;;;;;;
SGTIJIRA01-51604;800672;OKR1.6.1.1 Ser uma fonte confiável de dados unificada para companhia;Em Progresso;PI#8BAR;;;0.0;15;0;O1.6.1 Ser uma fonte confiável de dados unificada para companhia;KR1.6.1.1 Diminuir em 15% as inconsistências de data quality do ambiente;Ciclo 2025;3;;"BAR Infraestrutura e Ingestão
BAR Evolução da Jornada de dados de RE
BAR Evolução da Jornada de dados de AUTO";;Medição ao final do 4º trim;Não;VS_Gestão_de_dados;;0.0;BARE;;;;;;;;;;;;;;;;;;;;;SBARADAR08-198;SBARADAR06-354;SBARADAR06-369;SBARADAR06-374;SBARADAR05-188;SBARADAR05-183;SGTIJIRA01-51603;;;;;;;;;;;;;;;;;;;;
SGTIJIRA01-51603;800671;"OKR1.6 Modernizar e escalar a infraestrutura analítica, promovendo uma cultura data-driven que otimize processos, acelere decisões baseadas em dados e gere valor contínuo para o negócio";Em Progresso;PI#8BAR;;;20.0;50;0;"O1 Modernizar e escalar a infraestrutura analítica, promovendo uma cultura data-driven que otimize processos, acelere decisões baseadas em dados e gere valor contínuo para o negócio";KR1.6 Criar soluções de data quality para diminuir em 50% as inconsistências do ambiente;Ciclo 2025;1;;BAR Infraestrutura e Ingestão (Cross);;Medição ao final do 4º trim;Não;VS_Gestão_de_dados;;0.0;BARE;SGTIJIRA01-51604;;;;;;;;;;;;;;;;;;;;;;;;;;;;;;;;;;;;;;;;;;;;;;
SGTIJIRA01-51602;800670;OKR1.2.1.1  Melhorar o processo de abertura e acompanhamento dos avisos de sinistro residenciais;FINALIZADO;PI#8BAR;;;15.0;23;23;O1.2.1 Melhorar o processo de abertura e acompanhamento dos avisos de sinistro residenciais;KR1.2.1.1 Implantar melhorias em 8 jornadas de aviso e acompanhamento de sinistro residenciais;Ciclo 2025;2;Atingiu a Meta;BAR Modernização de Aviso Sinistro;;Medição ao final do 4º trim;Não;Sinistro_RE;;100.0;BARE;;;;;;;;;;;;;;;;;;;;;SBARSREF00-175;SBARSREF00-181;SBARSREF00-3;SBARSREF00-180;SGTIJIRA01-51166;;;;;;;;;;;;;;;;;;;;;;
SGTIJIRA01-51601;800669;OKR1.1.4.2 Facilitar a gestão de processos e simplificar a regulação de sinistro;FINALIZADO;PI#8BAR;;;0.0;1;1;O1.1.4 Facilitar a gestão de processos e simplificar a regulação de sinistro;KR1.1.4.2 Habilitar a abertura do aviso e regulação de um novo produto;Ciclo 2025;3;;"BAR Gestão de Sinistro RE
";;Medição ao final do 4º trim;Não;Sinistro_RE;;100.0;BARE;;;;;;;;;;;;;;;;;;;;;SBARSIRE00-796;SGTIJIRA01-51165;;;;;;;;;;;;;;;;;;;;;;;;;
