SGTIJIRA01-51437;745447;"OKR 8.1.1.1 - Evoluir com a estratégia de retenção na jornada de resgate prev no App Banco | Reduzir a taxa de conclusão em 1% na jornada de resgate Prev no App Banco";FINALIZADO;PI#16BVP;;;46.96;"45,96";"45,80";O8.1.1 Evoluir com a estratégia de retenção na jornada de resgate prev no App Banco;KR8.1.1.1 Reduzir a taxa de conclusão em 1% na jornada de resgate Prev no App Banco;Ciclo 2025;4;Atingiu a Meta;BVP Resgate Prev;;Medição ao final do 3º trim;Não;VS_Gest_Seguro;;100.0;BVP;SGTIJIRA01-51413;;;;;;;;;;;;;;;;;;;;SDIGVSBV00-36711;SDIGVSBV00-33043;;;;;;;;;;;;;;;;;;;;;;;;;
SGTIJIRA01-51436;745446;"OKR 7.3.1.1 - Melhorar a experiência da jornada digital do cliente Corporate |";Cancelado;PI#16BVP;;;21.0;"18,9";21;O7.3.1 Melhorar a experiência da jornada digital do cliente Corporate;KR7.3.1.1 Reduzir 10% de acionamento na Central de Atendimento para Resgates de Clientes Corporate para a causa raiz 'dificuldade em resgatar' - Corporate;Ciclo 2025;4;;BVP Resgate Prev;;Medição ao final do 3º trim;;VS_Gest_Seguro;;0.0;BVP;SGTIJIRA01-51412;;;;;;;;;;;;;;;;;;;;SDIGVSBV00-29677;SDIGVSBV00-37109;SDIGVSBV00-38185;;;;;;;;;;;;;;;;;;;;;;;;
SGTIJIRA01-51434;745442;"OKR 6.1.1.2 - Evoluir a desburocratização da jornada de sinistro vida e prev. | Pavimentação técnica para eliminação de 2 formulários físicos do checklist de documentos de sinistro vida e prev";FINALIZADO;PI#16BVP;;;0.0;2;2;O6.1.1 Evoluir a desburocratização da jornada de sinistro vida e prev.;KR6.1.1.2 Pavimentação técnica para eliminação de 2 formulários físicos do check-list de documentos de sinistro vida e prev.;Ciclo 2025;4;Atingiu a Meta;BVP Sinistro;;Medição ao final do 3º trim;Não;VS_Gest_Seguro;;100.0;BVP;SGTIJIRA01-51408;;;;;;;;;;;;;;;;;;;;SDIGVSBV00-33849;SDIGVSBV00-33848;SDIGVSBV00-33854;SDIGVSBV00-35341;;;;;;;;;;;;;;;;;;;;;;;
SGTIJIRA01-51433;745441;"OKR 6.1.1.1 - Evoluir a desburocratização da jornada de sinistro vida e prev | Eliminar 2 formulários físicos do check-list de documentos de sinistro vida e prev";FINALIZADO;PI#16BVP;;;0.0;2;2;O6.1.1 Evoluir a desburocratização da jornada de sinistro vida e prev;"KR6.1.1.1 Eliminar 2 formulários físicos do check-list de documentos de sinistro vida e prev
";Ciclo 2025;4;Atingiu a Meta;BVP Sinistro;;Medição ao final do 3º trim;Não;VS_Gest_Seguro;;100.0;BVP;SGTIJIRA01-51408;;;;;;;;;;;;;;;;;;;;SDIGVSBV00-33893;SDIGVSBV00-37047;SDIGVSBV00-33890;SDIGVSBV00-33891;SDIGVSBV00-33892;;;;;;;;;;;;;;;;;;;;;;
SGTIJIRA01-51432;744678;"OKR 10.4.1.1 - Fornecer detalhes adicionais na jornada de transferência interna | Implementar melhoria na tela de instrução";FINALIZADO;PI#16BVP;;;0.0;1;1;O10.4.1 Fornecer detalhes adicionais na jornada de transferência interna;KR10.4.1.1 Implementar melhoria na tela de instrução;Ciclo 2025;1;Atingiu a Meta;BVP Fidelização Previdência;;Medição ao final do 2º trim;Não;VS_Onb_Relacionamento;;100.0;BVP;SGTIJIRA01-51420;;;;;;;;;;;;;;;;;;;;SDIGVSBV00-35150;;;;;;;;;;;;;;;;;;;;;;;;;;
SGTIJIRA01-51431;744671;"OKR 10.3.1.1 - Promover autonomia ao cliente Previdência através da disponibilização de autosserviços | Disponibilizar 5 funcionalidades para autosserviço para os clientes Correntistas e Não Correntistas";FINALIZADO;PI#16BVP;;;0.0;5;5;O10.3.1 Promover autonomia ao cliente Previdência através da disponibilização de autosserviços;KR10.3.1.1 Disponibilizar 5 funcionalidades para autosserviço para os clientes Correntistas e Não Correntistas;Ciclo 2025;4;Atingiu a Meta;BVP Fidelização Previdência;;Medição ao final do 3º trim;Não;VS_Onb_Relacionamento;;100.0;BVP;SGTIJIRA01-51419;;;;;;;;;;;;;;;;;;;;SDIGVSBV00-35153;SDIGVSBV00-35428;SDIGVSBV00-33249;SDIGVSBV00-31499;SDIGVSBV00-35152;;;;;;;;;;;;;;;;;;;;;;
SGTIJIRA01-51430;744647;"OKR 10.2.2.1 - Direcionar o cliente a acessar canais mais modernos |  Inserir em 3 jornadas do PIVI a  mensagem redirecionando ao BSC";FINALIZADO;PI#16BVP;;;0.0;3;3;O10.2.2 Direcionar o cliente a acessar canais mais modernos;KR10.2.2.1 Inserir em 3 jornadas do PIVI a mensagem redirecionando ao BSC;Ciclo 2025;2;Atingiu a Meta;BVP Fidelização Vida;;Medição ao final do 2º trim;Não;VS_Onb_Relacionamento;;100.0;BVP;SGTIJIRA01-51418;;;;;;;;;;;;;;;;;;;;SDIGVSBV00-35343;SDIGVSBV00-35345;SDIGVSBV00-35347;;;;;;;;;;;;;;;;;;;;;;;;
SGTIJIRA01-51429;744644;"OKR 10.2.1.1 - Disponibilizar informações claras sobre as regras do produto aos clientes correntistas |  Disponibilizar 3 entregas que  facilitem o acesso a informação ";FINALIZADO;PI#16BVP;;;0.0;3;3;O10.2.1 Disponibilizar informações claras sobre as regras do produto aos clientes correntistas;KR10.2.1.1 Disponibilizar 3 entregas que facilitem o acesso a informação;Ciclo 2025;3;;BVP Fidelização Vida;;Medição ao final do 3º trim;;VS_Onb_Relacionamento;;100.0;BVP;SGTIJIRA01-51418;;;;;;;;;;;;;;;;;;;;SDIGVSBV00-36860;SDIGVSBV00-35740;SDIGVSBV00-35741;;;;;;;;;;;;;;;;;;;;;;;;
SGTIJIRA01-51428;744642;"OKR 10.1.1.1 - Promover autonomia ao cliente Vida através da disponibilização de autosserviços | KR10.1.1.1 Disponibilizar 3 funcionalidades para autosserviço para os clientes Correntistas e Não Correntistas";FINALIZADO;PI#16BVP;;;0.0;3;3;O10.1.1 Promover autonomia ao cliente Vida através da disponibilização de autosserviços;KR10.1.1.1 Disponibilizar 3 funcionalidades para autosserviço para os clientes Correntistas e Não Correntistas;Ciclo 2025;4;Atingiu a Meta;BVP Fidelização Vida;;Medição ao final do 3º trim;;VS_Onb_Relacionamento;;100.0;BVP;SGTIJIRA01-51417;;;;;;;;;;;;;;;;;;;;SDIGVSBV00-36545;SDIGVSBV00-36941;;;;;;;;;;;;;;;;;;;;;;;;;
SGTIJIRA01-51427;744641;"OKR 5.1.2.1 - Diversificar canais de venda através de parceiros comerciais | Facilitar para o corretor a contratação através do Multi-cálculo para venda de Produto Vida";FINALIZADO;PI#16BVP;;;0.0;1;1;O5.1.2 Diversificar canais de venda através de parceiros comerciais;KR5.1.2.1 Facilitar para o corretor a contratação através do Multi-cálculo para venda de Produto Vida;Ciclo 2025;4;Atingiu a Meta;BVP Parcerias Vida e Previdência;;Medição ao final do 3º trim;Não;VS_Est_VendasParcerias;;100.0;BVP;SGTIJIRA01-51407;;;;;;;;;;;;;;;;;;;;SDIGVSBV00-35080;SDIGVSBV00-35942;;;;;;;;;;;;;;;;;;;;;;;;;
SGTIJIRA01-51425;744638;"OKR 4.3.1.1 - Aumentar a eficiência de analises automáticas pelo Motor de Subscrição | Implementar fluxo automático de SLA expirado.";FINALIZADO;PI#16BVP;;;0.0;1;1;"O4.3.1 Aumentar a eficiência de analises automáticas pelo Motor de Subscrição
";KR4.3.1.1 Implementar fluxo automático de SLA expirado.;Ciclo 2025;3;;BVP Atuarial - Subscrição/Analytics;;Medição ao final do 3º trim;;VS_AqRent_Subscricao;;100.0;BVP;SGTIJIRA01-51406;;;;;;;;;;;;;;;;;;;;SDIGVSBV00-34931;;;;;;;;;;;;;;;;;;;;;;;;;;
SGTIJIRA01-51424;744635;"OKR 4.2.2.1 - Aumentar a autonomia do processo de Subscrição | Implantar 5 funcionalidades para gerenciar o consumo de APIs";FINALIZADO;PI#16BVP;;;0.0;5;5;O4.2.2 Aumentar a autonomia do processo de Subscrição;KR4.2.2.1 Implantar 5 funcionalidades para gerenciar o consumo de APIs;Ciclo 2025;1;Atingiu a Meta;BVP Atuarial - Subscrição/Analytics;;Medição ao final do 3º trim;Não;VS_AqRent_Subscricao;;100.0;BVP;SGTIJIRA01-51405;;;;;;;;;;;;;;;;;;;;SDIGVSBV00-34724;;;;;;;;;;;;;;;;;;;;;;;;;;
SGTIJIRA01-51423;744633;"OKR 4.2.1.1 - Aumentar a eficiência operacional do processo de Subscrição | Implementar melhoria em 2 filas de atendimento do processo de Subscrição";FINALIZADO;PI#16BVP;;;0.0;2;2;O4.2.1 Aumentar a eficiência operacional do processo de Subscrição;KR4.2.1.1 Implementar melhoria em 2 filas de atendimento do processo de Subscrição;Ciclo 2025;1;Atingiu a Meta;BVP Atuarial - Subscrição/Analytics;;Medição ao final do 2º trim;Não;VS_AqRent_Subscricao;;100.0;BVP;SGTIJIRA01-51405;;;;;;;;;;;;;;;;;;;;SDIGVSBV00-34428;;;;;;;;;;;;;;;;;;;;;;;;;;
SGTIJIRA01-51422;744631;"OKR 4.1.1.1 - Incluir processo de Endosso no Motor de Subscrição | Implantar 3 fluxos de endosso no processo de subscrição";FINALIZADO;PI#16BVP;;;0.0;3;3;O4.1.1 Incluir processo de Endosso no Motor de Subscrição;KR4.1.1.1 Implantar 3 fluxos de endosso no processo de subscrição;Ciclo 2025;4;Atingiu a Meta;BVP Atuarial - Subscrição/Analytics;;Medição ao final do 3º trim;Não;VS_AqRent_Subscricao;;100.0;BVP;SGTIJIRA01-51404;;;;;;;;;;;;;;;;;;;;SDIGVSBV00-36340;SDIGVSBV00-34930;SDIGVSBV00-36339;SDIGVSBV00-36338;SDIGVSBV00-36342;;;;;;;;;;;;;;;;;;;;;;
SGTIJIRA01-51421;744623;"OKR 3.2.1.1 - Tornar a operação dos produtos Prestamista mais ágil e eficaz | Habilitar 9 melhorias operacionais";FINALIZADO;PI#16BVP;;;0.0;9;9;"O3.2.1 Tornar a operação dos produtos Prestamista mais ágil e eficaz
";KR3.2.1.1 Habilitar 9 melhorias operacionais;Ciclo 2025;4;Atingiu a Meta;"BVP Vida e Prestamista - Novas Soluções
BVP Prestamista";;Medição ao final do 3º trim;;VS_AqRent_Prestamista;;100.0;BVP;SGTIJIRA01-51403;;;;;;;;;;;;;;;;;;;;SDIGVSBV00-36282;SDIGVSBV00-36032;SDIGVSBV00-36031;SDIGVSBV00-36281;SDIGVSBV00-35418;SDIGVSBV00-35921;SDIGVSBV00-36364;SDIGVSBV00-36741;SDIGVSBV00-35115;SDIGVSBV00-36738;SDIGVSBV00-36737;SDIGVSBV00-36624;SDIGVSBV00-35889;SDIGVSBV00-36735;SDIGVSBV00-34662;SDIGVSBV00-36114;SDIGVSBV00-34620;SDIGVSBV00-38424;SDIGVSBV00-39411;SDIGVSBV00-39415;;;;;;;
SGTIJIRA01-51420;744543;OKR10.4 - Transformar a experiência do cliente através de jornadas mais intuitivas e eficientes;Em Progresso;PI#16BVP;PI#17BVP;;23.0;"21,25";23;O10 Transformar a experiência do cliente através de jornadas mais intuitivas e eficientes;"KR10.4 Redução do número de detratores em 7,5% no NPS Relacional (Previdência) que  apontam a dor como sendo ""Acesso a informação""";Ciclo 2025;;;BVP Fidelização Previdencia;Será medido no decorrer da PI#17BVP;;;VS_Onb_Relacionamento;;0.0;BVP;;;;;;;;;;;;;;;;;;;;;SGTIJIRA01-51432;;;;;;;;;;;;;;;;;;;;;;;;;;
SGTIJIRA01-51419;744540;OKR10.3 - Transformar a experiência do cliente através de jornadas mais intuitivas e eficientes;Em Progresso;PI#16BVP;PI#17BVP;;48.0;53;48;O10 Transformar a experiência do cliente através de jornadas mais intuitivas e eficientes;KR10.3 Aumentar os números de autosserviços disponíveis em 10% para clientes Previdência até abril/2026;Ciclo 2025;;;BVP Fidelização Previdencia;Será medido no decorrer da PI#17BVP;;;VS_Onb_Relacionamento;;0.0;BVP;;;;;;;;;;;;;;;;;;;;;SGTIJIRA01-51431;SGTIJIRA01-58250;;;;;;;;;;;;;;;;;;;;;;;;;
SGTIJIRA01-51418;744539;OKR10.2 - Transformar a experiência do cliente através de jornadas mais intuitivas e eficientes;Em Progresso;PI#16BVP;PI#17BVP;;27.0;25;27;O10 Transformar a experiência do cliente através de jornadas mais intuitivas e eficientes;"KR10.2 Redução do número de detratores em 7,5% no NPS Relacional (Vida) que apontam a  dor como sendo ""Acesso a informação""";Ciclo 2025;;;BVP Fidelização Vida;Será medido no decorrer da PI#17BVP;;;VS_Onb_Relacionamento;;0.0;BVP;;;;;;;;;;;;;;;;;;;;;SGTIJIRA01-51430;SGTIJIRA01-51429;;;;;;;;;;;;;;;;;;;;;;;;;
SGTIJIRA01-51417;744537;OKR10.1 - Transformar a experiência do cliente através de jornadas mais intuitivas e eficientes;Em Progresso;PI#16BVP;PI#17BVP;;54.0;57;54;O10 Transformar a experiência do cliente através de jornadas mais intuitivas e eficientes;KR10.1 Aumentar os números de autosserviços disponíveis em 6% para clientes Vida até abril/2026;Ciclo 2025;;;BVP Fidelização Vida;Será medido no decorrer da PI#17BVP;;;VS_Onb_Relacionamento;;0.0;BVP;;;;;;;;;;;;;;;;;;;;;SGTIJIRA01-51428;;;;;;;;;;;;;;;;;;;;;;;;;;
SGTIJIRA01-51416;744620;"OKR 3.1.1.3 - Expandir o alcance e a atratividade do produto Prestamista por meio de novos canais, públicos e ações de visibilidade | Permitir o aumento da visibilidade do produto Prestamista na quinzena do Seguro";FINALIZADO;PI#16BVP;;;0.0;1;1;"O3.1.1 Expandir o alcance e a atratividade do produto Prestamista por meio de novos canais, públicos e ações de visibilidade";KR 3.1.1.3 Permitir o aumento da visibilidade do produto Prestamista na quinzena do Seguro;Ciclo 2025;2;Atingiu a Meta;BVP Prestamista;;Medição ao final do 2º trim;Não;VS_AqRent_Prestamista;;100.0;BVP;SGTIJIRA01-51402;;;;;;;;;;;;;;;;;;;;SDIGVSBV00-36033;;;;;;;;;;;;;;;;;;;;;;;;;;
SGTIJIRA01-51415;744534;OKR9.1 - Aumentar a segurança nas jornadas de resgate nos canais;Em Progresso;PI#16BVP;PI#17BVP;;0.0;3;0;O9 Aumentar a segurança nas jornadas de resgate nos canais;KR9.1 Implantar biometria facial automatizada em 2 jornadas digitais;Ciclo 2025;;;BVP Resgate Prev;;;;VS_Gest_Seguro;;0.0;BVP;;;;;;;;;;;;;;;;;;;;;SGTIJIRA01-58254;;;;;;;;;;;;;;;;;;;;;;;;;;
SGTIJIRA01-51413;744533;OKR8.1 - Oferecer alternativas estratégicas para retenção do cliente na jornada digital de resgate;Em Progresso;PI#16BVP;PI#17BVP;;46.96;"45,96";"46,96";O8 Oferecer alternativas estratégicas para retenção do cliente na jornada digital de resgate;KR8.1 Reduzir a taxa de conclusão em 1% na jornada de resgate Prev nos canais digitais;Ciclo 2025;;;BVP Resgate Prev;;;;VS_Gest_Seguro;;0.0;BVP;;;;;;;;;;;;;;;;;;;;;SGTIJIRA01-51437;;;;;;;;;;;;;;;;;;;;;;;;;;
SGTIJIRA01-51412;744532;OKR7.3 - Elevar a experiência do cliente na jornada de resgate através da evolução do autosserviço em canais digitais;Em Progresso;PI#16BVP;PI#17BVP;;1300.0;1235;1300;O7 Elevar a experiência do cliente na jornada de resgate através da evolução do autosserviço em canais digitais;KR7.3 Reduzir 5% de acionamentos na Central Corporate para as tabulações relacionadas a Resgate;Ciclo 2025;;;BVP Resgate Prev;Será medido no decorrer da PI#17BVP;;;VS_Gest_Seguro;;0.0;BVP;;;;;;;;;;;;;;;;;;;;;SGTIJIRA01-51436;;;;;;;;;;;;;;;;;;;;;;;;;;
SGTIJIRA01-51411;744530;OKR7.2 - Elevar a experiência do cliente na jornada de resgate através da evolução do autosserviço em canais digitais;A Fazer;PI#16BVP;PI#17BVP;;566.0;538;566;O7 Elevar a experiência do cliente na jornada de resgate através da evolução do autosserviço em canais digitais;KR7.2 Reduzir 5% a média de acionamento mensal na Central PF para a tabulação PAGAMENTO - RESGATE;Ciclo 2025;;;BVP Resgate Prev;;;;VS_Gest_Seguro;;0.0;BVP;;;;;;;;;;;;;;;;;;;;;;;;;;;;;;;;;;;;;;;;;;;;;;;
SGTIJIRA01-51410;744609;"OKR 3.1.1.1 - Expandir o alcance e a atratividade do produto Prestamista por meio de novos canais, públicos e ações de visibilidade | Habilitar produtos prestamista em 3 novos canais (E-agro, Expresso e App PDPJ)";FINALIZADO;PI#16BVP;;;0.0;3;2;"O3.1.1 Expandir o alcance e a atratividade do produto Prestamista por meio de novos canais, públicos e ações de visibilidade";"KR 3.1.1.1 Habilitar produtos prestamista em 3 novos canais (E-agro, Expresso e App PDPJ)";Ciclo 2025;4;Atingiu Parcialmente a Meta;BVP Prestamista;;Medição ao final do 3º trim;Não;VS_AqRent_Prestamista;;66.0;BVP;SGTIJIRA01-51402;;;;;;;;;;;;;;;;;;;;SDIGVSBV00-37243;SDIGVSBV00-37239;SDIGVSBV00-37240;SDIGVSBV00-37253;SDIGVSBV00-36046;SDIGVSBV00-36625;SDIGVSBV00-37170;SDIGVSBV00-37237;SDIGVSBV00-37238;SDIGVSBV00-37245;SDIGVSBV00-37244;;;;;;;;;;;;;;;;
SGTIJIRA01-51409;744526;OKR7.1 - Elevar a experiência do cliente na jornada de resgate através da evolução do autosserviço em canais digitais;Em Progresso;PI#16BVP;PI#17BVP;;201.0;141;201;O7 Elevar a experiência do cliente na jornada de resgate através da evolução do autosserviço em canais digitais;KR7.1 Migrar 30% dos clientes não correntistas para o autosserviço no APP BSC;Ciclo 2025;;;BVP Resgate Prev;Será medido no decorrer da PI#17BVP;;;VS_Gest_Seguro;;0.0;BVP;;;;;;;;;;;;;;;;;;;;;SGTIJIRA01-51435;;;;;;;;;;;;;;;;;;;;;;;;;;
SGTIJIRA01-51408;744523;OKR6.1 - Desburocratizar a jornada de sinistro vida e previdência;Em Progresso;PI#16BVP;PI#17BVP;;6.0;2;4;O6 Desburocratizar a jornada de sinistro vida e previdência;KR6.1 Eliminar 4 formulários físicos do checklist do beneficiário;Ciclo 2025;;;BVP Sinistro;Será medido no decorrer da PI#17BVP;;;VS_Gest_Seguro;;50.0;BVP;;;;;;;;;;;;;;;;;;;;;SGTIJIRA01-51433;SGTIJIRA01-51434;SGTIJIRA01-58251;;;;;;;;;;;;;;;;;;;;;;;;
SGTIJIRA01-51407;744520;"OKR5.1 - Aumentar o resultado da BVP com modelo de negócio inovador e disruptivo, para canais não explorados atualmente";Em Progresso;PI#16BVP;PI#17BVP;;0.0;100;0;"O5 Aumentar o resultado da BVP com modelo de negócio inovador e disruptivo, para canais não explorados atualmente";KR5.1 Atender 100% do pipeline comercial Vida e Previdência já sinalizado para parcerias externas até abril/2026;Ciclo 2025;;;BVP Parcerias Vida e Previdência;Será medido no decorrer da PI#17BVP;;;VS_Est_VendasParcerias;;0.0;BVP;;;;;;;;;;;;;;;;;;;;;SGTIJIRA01-51426;SGTIJIRA01-51427;SGTIJIRA01-58283;SGTIJIRA01-58260;;;;;;;;;;;;;;;;;;;;;;;
SGTIJIRA01-51406;744517;OKR4.3 - Fortalecer a inteligência analítica na subscrição para maximizar retorno e eficiência;Em Progresso;PI#16BVP;PI#17BVP;;91.0;92;91;O4 Fortalecer a inteligência analítica na subscrição para maximizar retorno e eficiência;KR4.3 Aumentar em 1% as análises automáticas de subscrição até abril/2026;Ciclo 2025;;;BVP Atuarial - Subscrição/Analytics;Será medido no decorrer da PI#17BVP;;;VS_AqRent_Subscricao;;0.0;BVP;;;;;;;;;;;;;;;;;;;;;SGTIJIRA01-51425;SGTIJIRA01-58249;;;;;;;;;;;;;;;;;;;;;;;;;
SGTIJIRA01-51405;744516;OKR4.2 - Fortalecer a inteligência analítica na subscrição para maximizar retorno e eficiência;Em Progresso;PI#16BVP;PI#17BVP;;2.0;1;2;O4 Fortalecer a inteligência analítica na subscrição para maximizar retorno e eficiência;KR4.2 Reduzir o tempo médio de decisão de subscrição de D+2 para D+1 dia com automação baseada em dados;Ciclo 2025;;;BVP Atuarial - Subscrição/Analytics;Será medido no decorrer da PI#17BVP;;;VS_AqRent_Subscricao;;0.0;BVP;;;;;;;;;;;;;;;;;;;;;SGTIJIRA01-51423;SGTIJIRA01-51424;SGTIJIRA01-58248;;;;;;;;;;;;;;;;;;;;;;;;
SGTIJIRA01-51404;744515;OKR4.1 - Fortalecer a inteligência analítica na subscrição para maximizar retorno e eficiência;Em Progresso;PI#16BVP;PI#17BVP;;0.0;0;0;O4 Fortalecer a inteligência analítica na subscrição para maximizar retorno e eficiência;KR4.1 Implementar modelo preditivo de risco para subscrição em 2% das cotações;Ciclo 2025;;;BVP Atuarial - Subscrição/Analytics;Será medido no decorrer da PI#17BVP;;;VS_AqRent_Subscricao;;0.0;BVP;;;;;;;;;;;;;;;;;;;;;SGTIJIRA01-51422;SGTIJIRA01-58247;;;;;;;;;;;;;;;;;;;;;;;;;
SGTIJIRA01-51403;744513;OKR3.2 - Aumentar a penetração e rentabilidade do seguro prestamista em canais estratégicos;Em Progresso;PI#16BVP;PI#17BVP;;0.0;100;0;O3 Aumentar a penetração e rentabilidade do seguro prestamista em canais estratégicos;KR3.2 Realizar 100% das melhorias operacionais para mitigar erros operacionais e melhorar a experiencia do Cliente;Ciclo 2025;;;"BVP Vida e Prestamista - Novas Soluções
BVP Prestamista";Será medido no decorrer da PI#17BVP;;;VS_AqRent_Prestamista;;0.0;BVP;SGTIJIRA01-58245;SGTIJIRA01-58246;;;;;;;;;;;;;;;;;;;SGTIJIRA01-51421;;;;;;;;;;;;;;;;;;;;;;;;;;
SGTIJIRA01-51402;744509;OKR3.1 - Aumentar a penetração e rentabilidade do seguro prestamista em canais estratégicos;Em Progresso;PI#16BVP;PI#17BVP;;0.0;5;0;O3 Aumentar a penetração e rentabilidade do seguro prestamista em canais estratégicos;KR3.1 Alavancar resultados dos Seguros Prestamista em novos canais com faturamento líquido de 5 milhões;Ciclo 2025;;;"BVP Vida e Prestamista - Novas Soluções
BVP Prestamista";Será medido no decorrer da PI#17BVP;;;VS_AqRent_Prestamista;;0.0;BVP;SGTIJIRA01-58244;SGTIJIRA01-51620;SGTIJIRA01-58243;;;;;;;;;;;;;;;;;;SGTIJIRA01-51416;SGTIJIRA01-51414;SGTIJIRA01-51410;SGTIJIRA01-58271;;;;;;;;;;;;;;;;;;;;;;;
SGTIJIRA01-51401;744500;OKR2.3 - Impulsionar o crescimento sustentável da comercialização dos produtos Previdência com estratégica de atração;Em Progresso;PI#16BVP;PI#17BVP;;185829.0;189546;185829;O2 Impulsionar o crescimento sustentável da comercialização dos produtos Previdência com estratégica de atração;"KR2.3 Aumentar a base de clientes na primeira camada (primeiro click) do funil das jornadas de ""cash-in"" no APP Banco em 2% até abril de 2026";Ciclo 2025;;;BVP Contratação Prev;Será medido no decorrer da PI#17BVP;;;VS_AqRent_Contratacao;;0.0;BVP;;;;;;;;;;;;;;;;;;;;;SGTIJIRA01-51439;;;;;;;;;;;;;;;;;;;;;;;;;;
SGTIJIRA01-51400;743997;OKR2.2 - Impulsionar o crescimento sustentável da comercialização dos produtos Previdência com estratégica de atração;Em Progresso;PI#16BVP;PI#17BVP;;64.5;"69,5";"64,5";O2 Impulsionar o crescimento sustentável da comercialização dos produtos Previdência com estratégica de atração;KR2.2 Aumentar em 5 pontos o NPS Transacional de Inscrição e NPS Transacional de Aporte no trimestre fevereiro a abril de 2026 comparado com o mesmo trimestre 2025;Ciclo 2025;;;BVP Contratação Prev;Será medido no decorrer da PI#17BVP;;;VS_AqRent_Contratacao;;0.0;BVP;;;;;;;;;;;;;;;;;;;;;SGTIJIRA01-51438;;;;;;;;;;;;;;;;;;;;;;;;;;
SGTIJIRA01-51399;743995;OKR2.1 - Impulsionar o crescimento sustentável da comercialização dos produtos Previdência com estratégica de atração;Em Progresso;PI#16BVP;PI#17BVP;;0.0;160;0;"O2 Impulsionar o crescimento sustentável da comercialização dos produtos Previdência com estratégica de atração
";KR2.1 Aumentar o faturamento de aporte e inscrição nos Canais Remotos de Contratação Previdência em 5% até abril de 2026 (milhões);Ciclo 2025;;;BVP Contratação Prev;Será medido no decorrer da PI#17BVP;;;VS_AqRent_Contratacao;;0.0;BVP;SGTIJIRA01-58240;;;;;;;;;;;;;;;;;;;;SGTIJIRA01-51440;SGTIJIRA01-58241;;;;;;;;;;;;;;;;;;;;;;;;;
SGTIJIRA01-51398;743992;"OKR1.2 - Agilizar e simplificar a comercialização dos produtos de Vida, melhorando a experiência do cliente e a eficiência operacional";A Fazer;PI#16BVP;PI#17BVP;;0.0;80;0;"O1 Agilizar e simplificar a comercialização dos produtos de Vida, melhorando a experiência do cliente e a eficiência operacional";KR1.2 Realizar 80% das manutenções requisitadas pelos produtos de Contratação Vida até abril/2026;Ciclo 2025;;;BVP Contratação Vida;;;;VS_AqRent_Contratacao;;0.0;BVP;;;;;;;;;;;;;;;;;;;;;;;;;;;;;;;;;;;;;;;;;;;;;;;
SGTIJIRA01-51396;743989;"OKR1.1 - Agilizar e simplificar a comercialização dos produtos de Vida, melhorando a experiência do cliente e a eficiência operacional";Em Progresso;PI#16BVP;PI#17BVP;;0.0;100;0;"O1 Agilizar e simplificar a comercialização dos produtos de Vida, melhorando a experiência do cliente e a eficiência operacional
";KR1.1 Garantir que 100% dos requisitos funcionais e de negócio do Produto Educacional Individual sejam validados e aprovados até março/2026;Ciclo 2025;;;BVP Contratação Vida;Será medido no decorrer da PI#17BVP;;;VS_AqRent_Contratacao;;0.0;BVP;;;;;;;;;;;;;;;;;;;;;SGTIJIRA01-51451;SGTIJIRA01-51452;SGTIJIRA01-58242;;;;;;;;;;;;;;;;;;;;;;;;
SGTIJIRA01-51351;743957;"OKR3.1.1.2 Promover autonomia ao Time Comercial quanto às consultas de implantação de agências, para viabilizar que as correções necessárias ocorram pelo próprio time, com maior agilidade.";FINALIZADO;PI#1OV;;;0.0;1;1;"O3.1.1 Promover autonomia ao Time Comercial quanto às consultas de implantação de agências, para viabilizar que as correções necessárias ocorram pelo próprio time, com maior agilidade.
";"KR3.1.1.2 Disponibilizar painel no Portal PGC, para consulta de produção, mercado alvo e gerente de relacionamento.
";Ciclo 2025;4;Atingiu a Meta;"Performance Banco
";;Medição ao final do 3º trim;Não;VS_PGC;;100.0;OV;SHOLOVSI01-1325;;;;;;;;;;;;;;;;;;;;SGTIJIRA01-51317;SHOLOVSI01-1386;SHOLOVSI01-1412;SHOLOVSI01-1324;;;;;;;;;;;;;;;;;;;;;;;
SGTIJIRA01-51350;743942;"OKR1.1.1.2 Promover novas visões no painel T&M, que simplifiquem a visualização de leads para serem trabalhados pelo Time Comercial";FINALIZADO;PI#1OV;;;0.0;1;1;"O1.1.1 Promover novas visões no painel T&M, que simplifiquem a visualização de leads para serem trabalhados pelo Time Comercial.";"KR1.1.1.2 Implantar novo painel de visualização de campanha comercial T&M (Evento T&M 2025 feedback dos corretores nova Home). Análise estratégica.
";Ciclo 2025;4;Atingiu a Meta;"Dados PGC
Performance Seguradora";;Medição ao final do 3º trim;Não;VS_PGC;;100.0;OV;SHOLOVSI00-4721;;;;;;;;;;;;;;;;;;;;SGTIJIRA01-51312;;;;;;;;;;;;;;;;;;;;;;;;;;
SGTIJIRA01-51322;734445;"OKR3.1.1.1 Promover autonomia ao Time Comercial quanto às consultas de implantação de agências, para viabilizar que as correções necessárias ocorram pelo próprio time, com maior agilidade.";FINALIZADO;PI#1OV;;;1.4;"1,36";"1,36";"O3.1.1 Promover autonomia ao Time Comercial quanto às consultas de implantação de agências, para viabilizar que as correções necessárias ocorram pelo próprio time, com maior agilidade.
";"KR3.1.1.1 Reduzir o volume de ocorrências no Portal PGC.
";Ciclo 2025;4;Atingiu a Meta;"Torre de Controle para Dados e Processos do Plano de Objetivo
Performance Banco
Performance Seguradora
";;Medição ao final do 3º trim;Não;VS_PGC;;100.0;OV;;;;;;;;;;;;;;;;;;;;;SHOLOVSI01-1381;SHOLOVSI01-1325;SHOLOVTC00-675;SGTIJIRA01-51317;SHOLOVSI00-4801;SHOLOVTC00-686;SHOLOVTC00-685;;;;;;;;;;;;;;;;;;;;
SGTIJIRA01-51320;734435;"OKR2.1.1.1 Acelerar a disponibilização de dados atualizados das empresas BARE e BVP, para apoiar as análises e a tomada de decisão do time comercial";FINALIZADO;PI#1OV;;;14.0;11;8;"O2.1.1 Acelerar a disponibilização de dados atualizados das empresas BARE e BVP, para apoiar as análises e a tomada de decisão do time comercial.
";"KR2.1.1.1 Reduzir o tempo médio de disponibilização de dados atualizados para o time comercial em até 3 horas.
";Ciclo 2025;4;Atingiu a Meta;"Torre de Controle para Dados e Processos do Plano de Objetivo
";;Medição ao final do 3º trim;Não;VS_PGC;;100.0;OV;;;;;;;;;;;;;;;;;;;;;SGTIJIRA01-51314;SHOLOVTC00-796;;;;;;;;;;;;;;;;;;;;;;;;;
